"type"	"id"	"reference_file_id"	"file_category"	"file_name"	"file_type"	"file_description"	"file_size"	"md5sum"	"reference_file_url"	"dcf_indexd_guid"	"study.id"
"reference_file"	"bcb7e2d9-cf8a-53a9-b492-d4b3d206ff54"	"f67a3dca-7887-4877-b8fa-06c6427f4a28"	"programmatic source code"	"c3dc_etl.py"	"py"	"Python script implementation of ETL process"	"74835"	"a433b65dbbc21b2f49d14e60fe5ca7cd"	"https://github.com/chicagopcdc/c3dc_etl/blob/20240909.1/etl/target/c3dc_etl.py"	"59304658-4aa3-4523-a9f2-ca428aacfc5d"	"924ff0fd-6a35-524e-ae84-a5e10acfc8b1"
"reference_file"	"b7c0dfb1-b647-5356-b392-81ae2565270b"	"00491c02-0737-4649-9532-06f592cb4f8e"	"output schema"	"schema.json"	"json"	"JSON schema representation of YAML C3DC model schema"	"161700"	"623405401a8dfc4f0f24b14600d19689"	"https://github.com/chicagopcdc/c3dc_etl/blob/20240909.1/schema/schema.json"	"40c5766e-9c8a-4d4c-a2ba-67a3a3dd3889"	"924ff0fd-6a35-524e-ae84-a5e10acfc8b1"
"reference_file"	"f22bc2d0-22e5-5000-aacc-f944ce4ca582"	"7dacd12b-9a48-441e-9e04-2adaed2bfd1d"	"transformation/mapping"	"C3DC Mappings.xlsx"	"xlsx"	"Excel spreadsheet (XLSX) file containing tabular source-to-destination mappings and transformations. Transformed by mapping unpivoter script into JSON format for input into ETL script."	"185762"	"e53efd301f5d2805865ce43ee3b8a5ea"	"https://github.com/chicagopcdc/c3dc_etl/blob/20240909.1/mapping_unpivoter/C3DC%20Mappings.xlsx"	"10c6941e-a436-4c6a-9583-1f08e416885f"	"924ff0fd-6a35-524e-ae84-a5e10acfc8b1"
"reference_file"	"44e6fdd3-9923-5dd7-b96f-161a4a5ae542"	"ca3d685e-4cf4-4c50-bd7f-ae0a5e37680e"	"transformation/mapping"	"phs000466.json"	"json"	"JSON file containing source-to-destination mappings and transformations. The self-referential properties 'file_size' and 'md5sum' are set to the values calculated when both fields are set to 0 and blank ('') respectively"	"35399"	"af2881079cb516c9e6cb627d7e44620a"	"https://github.com/chicagopcdc/c3dc_etl/blob/20240909.1/etl/target/transformations/phs000466.json"	"f21a436d-f40d-4d7b-99f7-00d9a4cf040a"	"924ff0fd-6a35-524e-ae84-a5e10acfc8b1"
"reference_file"	"2fc18684-4b7f-5e28-8e94-26995e229251"	"34a5663c-0dcf-439c-9d47-533b0480c86b"	"input source data"	"TARGET_CCSK_ClinicalData_Discovery_20170525.xlsx"	"xlsx"	"Excel spreadsheet (XLSX) file containing input source data"	"13943"	"45860c6e180a2b6042e73af6c1016155"	"s3://cds-447-target-c3dc/TARGET-CCSK_clinicalData_PUBLIC_20220207/TARGET_CCSK_ClinicalData_Discovery_20170525.xlsx"	"dg.4DFC/06cad875-377b-4f06-87cd-d63e9e87f358"	"924ff0fd-6a35-524e-ae84-a5e10acfc8b1"
