"type"	"id"	"reference_file_id"	"file_name"	"file_type"	"file_description"	"file_category"	"file_size"	"md5sum"	"reference_file_url"	"dcf_indexd_guid"	"study.id"
"reference_file"	"b171ec5b-217a-5d00-8920-f2d15be0e896"	"f67a3dca-7887-4877-b8fa-06c6427f4a28"	"c3dc_etl.py"	"py"	"Python script implementation of ETL process"	"programmatic source code"	"124298"	"88c74519a20f5f549317e76d64fc0080"	"https://github.com/chicagopcdc/c3dc_etl/blob/20250822.1/etl/target/c3dc_etl.py"	"59304658-4aa3-4523-a9f2-ca428aacfc5d"	"898230ba-cae3-5f00-bb9b-68a6bedde399"
"reference_file"	"149d323a-2af0-5e9a-8ca5-02e9b2bd061e"	"00491c02-0737-4649-9532-06f592cb4f8e"	"schema.json"	"json"	"JSON schema representation of YAML C3DC model schema"	"output schema"	"386533"	"de2768a4a26c8ffbd5b757b0e1e32002"	"https://github.com/chicagopcdc/c3dc_etl/blob/20250822.1/schema/schema.json"	"40c5766e-9c8a-4d4c-a2ba-67a3a3dd3889"	"898230ba-cae3-5f00-bb9b-68a6bedde399"
"reference_file"	"4bda11d7-60a2-55bf-bd7f-60366687101d"	"7dacd12b-9a48-441e-9e04-2adaed2bfd1d"	"C3DC Mappings.xlsx"	"xlsx"	"Excel spreadsheet (XLSX) file containing tabular source-to-destination mappings and transformations. Transformed by mapping unpivoter script into JSON format for input into ETL script."	"transformation/mapping"	"590473"	"2df46fac0760a2230d4dec0bf5692454"	"https://github.com/chicagopcdc/c3dc_etl/blob/20250822.1/mapping_unpivoter/C3DC%20Mappings.xlsx"	"10c6941e-a436-4c6a-9583-1f08e416885f"	"898230ba-cae3-5f00-bb9b-68a6bedde399"
"reference_file"	"f0b4131a-cf03-5033-87ee-72e861cb2582"	"ca3d685e-4cf4-4c50-bd7f-ae0a5e37680e"	"phs000466.json"	"json"	"JSON file containing source-to-destination mappings and transformations. The self-referential properties 'file_size' and 'md5sum' are set to the values calculated when both fields are set to 0 and blank ('') respectively"	"transformation/mapping"	"41081"	"0facc3b4397e8a98d816669fe06ca468"	"https://github.com/chicagopcdc/c3dc_etl/blob/20250822.1/etl/target/transformations/phs000466.json"	"f21a436d-f40d-4d7b-99f7-00d9a4cf040a"	"898230ba-cae3-5f00-bb9b-68a6bedde399"
"reference_file"	"fb59b48f-42e7-5b84-adf2-8b850fffb257"	"34a5663c-0dcf-439c-9d47-533b0480c86b"	"TARGET_CCSK_ClinicalData_Discovery_20170525.xlsx"	"xlsx"	"Excel spreadsheet (XLSX) file containing input source data"	"input source data"	"13943"	"45860c6e180a2b6042e73af6c1016155"	"s3://cds-447-target-c3dc/TARGET-CCSK_clinicalData_PUBLIC_20220207/TARGET_CCSK_ClinicalData_Discovery_20170525.xlsx"	"dg.4DFC/06cad875-377b-4f06-87cd-d63e9e87f358"	"898230ba-cae3-5f00-bb9b-68a6bedde399"
