"type"	"id"	"reference_file_id"	"file_category"	"file_name"	"file_type"	"file_description"	"file_size"	"md5sum"	"reference_file_url"	"dcf_indexd_guid"	"study.id"
"reference_file"	"85572a3c-9936-5db8-88e8-8a71526a0a71"	"c1e9f42a-270f-44d9-849e-1ecfae525682"	"programmatic source code"	"c3dc_etl.py"	"py"	"Python script implementation of ETL process"	"75875"	"1ccb7b8a1f0de4df909613963ff4ba19"	"https://github.com/chicagopcdc/c3dc_etl/blob/20240909.1/etl/ccdi/c3dc_etl.py"	"bb5d5298-0c7a-41d3-a8e2-7dbe43ac01b0"	"46bd3814-87a3-579a-b789-d24c06eb6446"
"reference_file"	"45c9b154-89de-5ae7-a5f8-ec55707eaeab"	"7e612eff-01ae-4ef8-a226-155537a5ae55"	"output schema"	"schema.json"	"json"	"JSON schema representation of YAML C3DC model schema"	"161700"	"623405401a8dfc4f0f24b14600d19689"	"https://github.com/chicagopcdc/c3dc_etl/blob/20240909.1/schema/schema.json"	"f0587c4c-306d-496e-8904-2bd6e96a2351"	"46bd3814-87a3-579a-b789-d24c06eb6446"
"reference_file"	"7b702338-40de-5915-ae0a-d766930dee6f"	"36dc1fc0-aeec-46bd-885c-c5bbf6ac9058"	"transformation/mapping"	"C3DC Mappings.xlsx"	"xlsx"	"Excel spreadsheet (XLSX) file containing tabular source-to-destination mappings and transformations. Transformed by mapping unpivoter script into JSON format for input into ETL script."	"185762"	"e53efd301f5d2805865ce43ee3b8a5ea"	"https://github.com/chicagopcdc/c3dc_etl/blob/20240909.1/mapping_unpivoter/C3DC%20Mappings.xlsx"	"56e605d2-6b1c-4541-a46e-7cbc4c88e518"	"46bd3814-87a3-579a-b789-d24c06eb6446"
"reference_file"	"8a7cd9fc-3f5f-5743-bc30-7542b7be2218"	"5a971423-894b-43ca-91ab-f5d337ea3464"	"transformation/mapping"	"phs002677.json"	"json"	"JSON file containing source-to-destination mappings and transformations. The self-referential properties 'file_size' and 'md5sum' are set to the values calculated when both fields are set to 0 and blank ('') respectively"	"38268"	"7610a9aa64220d07491530755cb5dda2"	"https://github.com/chicagopcdc/c3dc_etl/blob/20240909.1/etl/ccdi/transformations/phs002677.json"	"77729647-4300-46c3-adc1-4629a5dbccda"	"46bd3814-87a3-579a-b789-d24c06eb6446"
"reference_file"	"b75ecf54-96be-5d42-9e86-ce24e8eab435"	"fcfa5c3e-9249-4f23-87b4-f9e38da4a767"	"input source data"	"CCDI_Submission_Template_v1.9.1_phs002677_JoinRy_2024-08-14.xlsx"	"xlsx"	"Excel spreadsheet (XLSX) file containing input source data"	"456046"	"28bb898330ee2c58da12be966302cecb"	"See CCDI Hub at https://ccdi.cancer.gov/explore"	"34a2f639-6ef8-4d39-8b7d-1a33dc03e0c8"	"46bd3814-87a3-579a-b789-d24c06eb6446"
