"type"	"id"	"reference_file_id"	"file_name"	"file_type"	"file_description"	"file_category"	"file_size"	"md5sum"	"reference_file_url"	"dcf_indexd_guid"	"study.id"
"reference_file"	"1a30b71c-3462-5acf-9474-a1fdc351b599"	"038020fa-c3dd-45b7-8521-db90ce447aaa"	"c3dc_etl.py"	"py"	"Python script implementation of ETL process"	"programmatic source code"	"78570"	"f91beb4cb0691363860d205deb142872"	"https://github.com/chicagopcdc/c3dc_etl/blob/20250822.1/etl/ccdi/c3dc_etl.py"	"c22b51f0-beb4-47d0-9b39-3869241a76a1"	"68682a39-abad-5a33-9fff-14df901dd3e7"
"reference_file"	"25c351f3-7f46-55b1-9173-c9fd40f7d74f"	"9d5f351d-1545-4784-bd41-705b25aa0023"	"schema.json"	"json"	"JSON schema representation of YAML C3DC model schema"	"output schema"	"386533"	"de2768a4a26c8ffbd5b757b0e1e32002"	"https://github.com/chicagopcdc/c3dc_etl/blob/20250822.1/schema/schema.json"	"3adca7ea-083e-4226-b5de-f2a4957b4169"	"68682a39-abad-5a33-9fff-14df901dd3e7"
"reference_file"	"71eba3a8-7a03-5c5d-aeb6-ea2343cec62e"	"64ba9340-d15b-4762-a110-cf0cfeaf17e4"	"C3DC Mappings.xlsx"	"xlsx"	"Excel spreadsheet (XLSX) file containing tabular source-to-destination mappings and transformations. Transformed by mapping unpivoter script into JSON format for input into ETL script."	"transformation/mapping"	"590473"	"2df46fac0760a2230d4dec0bf5692454"	"https://github.com/chicagopcdc/c3dc_etl/blob/20250822.1/mapping_unpivoter/C3DC%20Mappings.xlsx"	"b0aed3b9-ec13-4e04-a432-a3e4a3c70f31"	"68682a39-abad-5a33-9fff-14df901dd3e7"
"reference_file"	"ce2088a7-d8a9-50bf-9867-63953276ac20"	"85532562-57b3-4786-8b9c-f05aa5d9018c"	"phs002430.json"	"json"	"JSON file containing source-to-destination mappings and transformations. The self-referential properties 'file_size' and 'md5sum' are set to the values calculated when both fields are set to 0 and blank ('') respectively"	"transformation/mapping"	"49735"	"fca7542a2883425572de42c041bb5040"	"https://github.com/chicagopcdc/c3dc_etl/blob/20250822.1/etl/ccdi/transformations/phs002430.json"	"929682ce-8142-402f-94d3-ce5a9dd797f0"	"68682a39-abad-5a33-9fff-14df901dd3e7"
"reference_file"	"eb2e352e-053e-5073-b92f-5fafb3031f0d"	"f6bf6645-b3ae-479d-a086-bec661b30e12"	"CCDI_Submission_Template_v3.1.0_phs002430_JoinRy_2025-08-04.xlsx"	"xlsx"	"Excel spreadsheet (XLSX) file containing input source data"	"input source data"	"1135112"	"f275bb919df26a04118f0ad25798fe84"	"See CCDI Hub at https://ccdi.cancer.gov/explore"	"3fbf00db-8da3-4242-a37c-cdc2ca540665"	"68682a39-abad-5a33-9fff-14df901dd3e7"
