"type"	"id"	"reference_file_id"	"file_name"	"file_type"	"file_description"	"file_category"	"file_size"	"md5sum"	"reference_file_url"	"dcf_indexd_guid"	"study.id"
"reference_file"	"e3e49336-686e-5081-b8e2-0c850fdee297"	"f5baaec5-d74c-464f-8371-5484cae360b3"	"c3dc_etl.py"	"py"	"Python script implementation of ETL process"	"programmatic source code"	"78570"	"f91beb4cb0691363860d205deb142872"	"https://github.com/chicagopcdc/c3dc_etl/blob/20250822.1/etl/ccdi/c3dc_etl.py"	"d8617be4-cc71-408e-b588-76a94cab0605"	"44def602-532d-57f5-88ee-e5de85af882b"
"reference_file"	"b5441a4e-12d7-5402-9c50-5933e87184da"	"f8e11ee1-6ba7-4cdb-b65c-f41f14a36039"	"schema.json"	"json"	"JSON schema representation of YAML C3DC model schema"	"output schema"	"386533"	"de2768a4a26c8ffbd5b757b0e1e32002"	"https://github.com/chicagopcdc/c3dc_etl/blob/20250822.1/schema/schema.json"	"d10d0afe-1365-4e0d-ad3c-f4c68fcdd0d7"	"44def602-532d-57f5-88ee-e5de85af882b"
"reference_file"	"88ae4bcf-88af-52aa-b7e1-e8e79434a054"	"19a83622-513b-470d-b82e-1bdaff1f866a"	"C3DC Mappings.xlsx"	"xlsx"	"Excel spreadsheet (XLSX) file containing tabular source-to-destination mappings and transformations. Transformed by mapping unpivoter script into JSON format for input into ETL script."	"transformation/mapping"	"590473"	"2df46fac0760a2230d4dec0bf5692454"	"https://github.com/chicagopcdc/c3dc_etl/blob/20250822.1/mapping_unpivoter/C3DC%20Mappings.xlsx"	"418628df-758b-4277-a740-ab59f7aa6252"	"44def602-532d-57f5-88ee-e5de85af882b"
"reference_file"	"0f4624ef-3583-59d4-9a7a-82b30a69dbbe"	"3debc744-5a31-402e-a4e8-46624f248610"	"phs002431.json"	"json"	"JSON file containing source-to-destination mappings and transformations. The self-referential properties 'file_size' and 'md5sum' are set to the values calculated when both fields are set to 0 and blank ('') respectively"	"transformation/mapping"	"62811"	"88a8908f16401104f3d7051f51fa8b60"	"https://github.com/chicagopcdc/c3dc_etl/blob/20250822.1/etl/ccdi/transformations/phs002431.json"	"50c6a6b9-d8b7-4098-bbc8-92dcd92cbff3"	"44def602-532d-57f5-88ee-e5de85af882b"
"reference_file"	"bdecfa5d-9e24-52ee-9d16-b3c79c9c0ccf"	"69570967-a87c-4a2e-bf0d-8337d3a224ee"	"CCDI_Submission_Template_v3.1.0_phs002431_JoinRy_2025-08-04.xlsx"	"xlsx"	"Excel spreadsheet (XLSX) file containing input source data"	"input source data"	"18173641"	"66e1aee782ff1095ea89d9ea34d2cc08"	"See CCDI Hub at https://ccdi.cancer.gov/explore"	"1bc65c05-8a7b-4667-b76e-b538c8fc3397"	"44def602-532d-57f5-88ee-e5de85af882b"
