"type"	"id"	"reference_file_id"	"file_name"	"file_type"	"file_description"	"file_category"	"file_size"	"md5sum"	"reference_file_url"	"dcf_indexd_guid"	"study.id"
"reference_file"	"0e264c5d-5857-553d-8098-2fd5c052efc2"	"9c3e66ce-0fdf-4bf3-a6b7-78eb56d1724e"	"c3dc_etl.py"	"py"	"Python script implementation of ETL process"	"programmatic source code"	"78570"	"f91beb4cb0691363860d205deb142872"	"https://github.com/chicagopcdc/c3dc_etl/blob/20250822.1/etl/ccdi/c3dc_etl.py"	"acf92f81-c78f-44c9-9d15-548011de5f0c"	"682fe164-aa0e-5546-b2f0-8ecd7c1983bf"
"reference_file"	"01d3f21d-b70b-526d-9dbe-b784c3d23094"	"94eb5459-cf37-4fb6-8006-00f1b8574d8c"	"schema.json"	"json"	"JSON schema representation of YAML C3DC model schema"	"output schema"	"386533"	"de2768a4a26c8ffbd5b757b0e1e32002"	"https://github.com/chicagopcdc/c3dc_etl/blob/20250822.1/schema/schema.json"	"1eb709fb-46dc-42c5-9c6a-b5378291c589"	"682fe164-aa0e-5546-b2f0-8ecd7c1983bf"
"reference_file"	"1dbae37c-e131-5e39-b382-5128b20bf4e5"	"7783edf3-1f19-4f36-b03a-4697789ed41b"	"C3DC Mappings.xlsx"	"xlsx"	"Excel spreadsheet (XLSX) file containing tabular source-to-destination mappings and transformations. Transformed by mapping unpivoter script into JSON format for input into ETL script."	"transformation/mapping"	"590473"	"2df46fac0760a2230d4dec0bf5692454"	"https://github.com/chicagopcdc/c3dc_etl/blob/20250822.1/mapping_unpivoter/C3DC%20Mappings.xlsx"	"fa64e153-accf-47a8-8b23-cbbf38af79dc"	"682fe164-aa0e-5546-b2f0-8ecd7c1983bf"
"reference_file"	"cad46ff3-9a17-5464-887c-62e3c6b2ab72"	"33524eb8-3398-4bc4-a8d8-e91796a8acf5"	"phs003160.json"	"json"	"JSON file containing source-to-destination mappings and transformations. The self-referential properties 'file_size' and 'md5sum' are set to the values calculated when both fields are set to 0 and blank ('') respectively"	"transformation/mapping"	"49539"	"c9955efc908e217e9a9f91b374e0a396"	"https://github.com/chicagopcdc/c3dc_etl/blob/20250822.1/etl/ccdi/transformations/phs003160.json"	"0af218b3-df24-47fd-b373-5e68ef890aae"	"682fe164-aa0e-5546-b2f0-8ecd7c1983bf"
"reference_file"	"5794d4cd-2d1b-5c46-acc2-a216e0172745"	"735e3645-d70c-4a09-97fc-a0d741fa4735"	"CCDI_Submission_Template_v3.1.0_phs003160_JoinRy_2025-08-04.xlsx"	"xlsx"	"Excel spreadsheet (XLSX) file containing input source data"	"input source data"	"3785372"	"7750eecf8458ef035e886ac664ef4342"	"See CCDI Hub at https://ccdi.cancer.gov/explore"	"578e4e1c-82a5-492a-a448-290cb83453e6"	"682fe164-aa0e-5546-b2f0-8ecd7c1983bf"
