"type"	"id"	"reference_file_id"	"file_category"	"file_name"	"file_type"	"file_description"	"file_size"	"md5sum"	"reference_file_url"	"dcf_indexd_guid"	"study.id"
"reference_file"	"e7628923-6a35-5036-b714-c30550a41b44"	"d5f5237e-bd2a-4c08-ad63-34b6ad0d2251"	"programmatic source code"	"c3dc_etl.py"	"py"	"Python script implementation of ETL process"	"75875"	"1ccb7b8a1f0de4df909613963ff4ba19"	"https://github.com/chicagopcdc/c3dc_etl/blob/20240909.1/etl/ccdi/c3dc_etl.py"	"3080be7a-9279-4ed9-81dc-a5116d45ea64"	"4148a9cc-52b9-51cc-9f2f-ab5884970034"
"reference_file"	"2f1162bb-6757-5eb5-a21d-8e14dacb32cd"	"81133d98-9295-46df-96f2-6bcc20f0f6ee"	"output schema"	"schema.json"	"json"	"JSON schema representation of YAML C3DC model schema"	"161700"	"623405401a8dfc4f0f24b14600d19689"	"https://github.com/chicagopcdc/c3dc_etl/blob/20240909.1/schema/schema.json"	"d764c3b4-7cfe-4ecc-8a84-0c07e6657dfc"	"4148a9cc-52b9-51cc-9f2f-ab5884970034"
"reference_file"	"b600a9e5-43fe-5c30-b78a-985ccbd9eeb5"	"0de26929-7aaf-4e3f-a708-7a3e9d7c26a1"	"transformation/mapping"	"C3DC Mappings.xlsx"	"xlsx"	"Excel spreadsheet (XLSX) file containing tabular source-to-destination mappings and transformations. Transformed by mapping unpivoter script into JSON format for input into ETL script."	"185762"	"e53efd301f5d2805865ce43ee3b8a5ea"	"https://github.com/chicagopcdc/c3dc_etl/blob/20240909.1/mapping_unpivoter/C3DC%20Mappings.xlsx"	"78e15101-b2b0-43aa-b763-69f377478902"	"4148a9cc-52b9-51cc-9f2f-ab5884970034"
"reference_file"	"0f2fec57-67ea-5d49-9f0f-d46d5aedb425"	"0581e4b1-039f-4f19-9034-132efee84a70"	"transformation/mapping"	"phs002529.json"	"json"	"JSON file containing source-to-destination mappings and transformations. The self-referential properties 'file_size' and 'md5sum' are set to the values calculated when both fields are set to 0 and blank ('') respectively"	"37877"	"dec040470b9e44b4ea6034700c115710"	"https://github.com/chicagopcdc/c3dc_etl/blob/20240909.1/etl/ccdi/transformations/phs002529.json"	"92bdee4c-522c-4479-b667-82ae5c71a324"	"4148a9cc-52b9-51cc-9f2f-ab5884970034"
"reference_file"	"d3fd8ea2-c6ba-5e37-87d4-39955bffdc75"	"ca02183c-ba68-451f-adf0-1f9df9af70c9"	"input source data"	"CCDI_Submission_Template_v1.9.1_phs002529_JoinRy_2024-08-14.xlsx"	"xlsx"	"Excel spreadsheet (XLSX) file containing input source data"	"1339393"	"d76ad0a5358944362a43fb3064bd7b8a"	"See CCDI Hub at https://ccdi.cancer.gov/explore"	"e6bd55ac-6edc-4e1e-8ec3-291cbcfb7738"	"4148a9cc-52b9-51cc-9f2f-ab5884970034"
