"type"	"id"	"reference_file_id"	"file_category"	"file_name"	"file_type"	"file_description"	"file_size"	"md5sum"	"reference_file_url"	"dcf_indexd_guid"	"study.id"
"reference_file"	"3484594d-68bd-5506-a487-f6722a27e215"	"8e83c505-decb-410b-bb68-0558f012cc5d"	"programmatic source code"	"c3dc_etl.py"	"py"	"Python script implementation of ETL process"	"75957"	"b2872e00d5c07bd80e56e7e6c015d7e2"	"https://github.com/chicagopcdc/c3dc_etl/blob/20241028.1/etl/target/c3dc_etl.py"	"2ef5a998-51d7-434f-887c-ae0cec5247b0"	"2b90f5fe-9759-5f63-9319-f0483137596c"
"reference_file"	"a1b6d6bb-6c16-5079-bc9d-b185a165d007"	"2ab5a9d5-1602-4633-8597-005a0444d5f4"	"output schema"	"schema.json"	"json"	"JSON schema representation of YAML C3DC model schema"	"161683"	"02b9c0979f87de1212fbe544d0ab1952"	"https://github.com/chicagopcdc/c3dc_etl/blob/20241028.1/schema/schema.json"	"23d7687a-db58-4efd-a5a5-23496267ad19"	"2b90f5fe-9759-5f63-9319-f0483137596c"
"reference_file"	"4598aaee-6e08-5c34-8dad-2cb5c0052f57"	"affadc79-12ed-4427-8c76-fa4bfdd91ed5"	"transformation/mapping"	"C3DC Mappings.xlsx"	"xlsx"	"Excel spreadsheet (XLSX) file containing tabular source-to-destination mappings and transformations. Transformed by mapping unpivoter script into JSON format for input into ETL script."	"210058"	"9d1f2ac589ae3f820f7b6b93289aeac6"	"https://github.com/chicagopcdc/c3dc_etl/blob/20241028.1/mapping_unpivoter/C3DC%20Mappings.xlsx"	"93ae5c1f-d433-4274-97a8-d0bdf719501c"	"2b90f5fe-9759-5f63-9319-f0483137596c"
"reference_file"	"ba6e73d6-4c4d-525b-b96a-bf17cda472a7"	"eda367e3-a118-4a58-9099-c0fffee022ec"	"transformation/mapping"	"phs000469.json"	"json"	"JSON file containing source-to-destination mappings and transformations. The self-referential properties 'file_size' and 'md5sum' are set to the values calculated when both fields are set to 0 and blank ('') respectively"	"40469"	"c4198e82584a73613e7632117626dc9b"	"https://github.com/chicagopcdc/c3dc_etl/blob/20241028.1/etl/target/transformations/phs000469.json"	"b55d2838-0284-4aaf-9900-029409402e5a"	"2b90f5fe-9759-5f63-9319-f0483137596c"
"reference_file"	"9c344ad6-047c-5da5-ab21-4ac3d6b6f462"	"c408f79f-40da-46d2-9764-3d6f3ea1ea0b"	"input source data"	"TARGET_MDLS-NBL_ClinicalData_20151124.xlsx"	"xlsx"	"Excel spreadsheet (XLSX) file containing input source data"	"77137"	"2b744fe193c7edc4c908333a6d9540fe"	"s3://cds-447-target-c3dc/TARGET-MDLS-NBL_clinicalData_PUBLIC_20220207/TARGET_MDLS-NBL_ClinicalData_20151124.xlsx"	"dg.4DFC/1e1a2a5b-3a9b-4a07-9287-f6286c3c9300"	"2b90f5fe-9759-5f63-9319-f0483137596c"
