"type"	"id"	"reference_file_id"	"file_name"	"file_type"	"file_description"	"file_category"	"file_size"	"md5sum"	"reference_file_url"	"dcf_indexd_guid"	"study.id"
"reference_file"	"a3c831d5-58a1-5d74-b539-60f3a8d8a857"	"4422cd93-c65b-4d9f-8656-c993b571e059"	"c3dc_etl.py"	"py"	"Python script implementation of ETL process"	"programmatic source code"	"78570"	"f91beb4cb0691363860d205deb142872"	"https://github.com/chicagopcdc/c3dc_etl/blob/20250822.1/etl/ccdi/c3dc_etl.py"	"399d57b4-0e9f-4828-a556-a585a59a144c"	"a9970b40-2046-504a-86c6-682e6c73f434"
"reference_file"	"bbdd39f8-5497-5a96-845f-d184073eb6c3"	"6e5e5325-dc6c-4983-9249-bc8a748de472"	"schema.json"	"json"	"JSON schema representation of YAML C3DC model schema"	"output schema"	"386533"	"de2768a4a26c8ffbd5b757b0e1e32002"	"https://github.com/chicagopcdc/c3dc_etl/blob/20250822.1/schema/schema.json"	"3f750dd0-96fb-45a1-a313-a36d75358818"	"a9970b40-2046-504a-86c6-682e6c73f434"
"reference_file"	"f2a207a5-7a94-5fac-b025-8a48ca8514fa"	"de475178-a567-4fe8-b23a-b40d1e5d4636"	"C3DC Mappings.xlsx"	"xlsx"	"Excel spreadsheet (XLSX) file containing tabular source-to-destination mappings and transformations. Transformed by mapping unpivoter script into JSON format for input into ETL script."	"transformation/mapping"	"590473"	"2df46fac0760a2230d4dec0bf5692454"	"https://github.com/chicagopcdc/c3dc_etl/blob/20250822.1/mapping_unpivoter/C3DC%20Mappings.xlsx"	"fa762c08-e04f-40e5-b268-4eaa99cd465f"	"a9970b40-2046-504a-86c6-682e6c73f434"
"reference_file"	"44798e3b-c6a9-5929-83bf-2e70db700b4f"	"853f23e6-d14f-41c7-8fa3-257a62cf79bd"	"phs003519.json"	"json"	"JSON file containing source-to-destination mappings and transformations. The self-referential properties 'file_size' and 'md5sum' are set to the values calculated when both fields are set to 0 and blank ('') respectively"	"transformation/mapping"	"49770"	"ea37524d25327c44dc66380ca1ccf94f"	"https://github.com/chicagopcdc/c3dc_etl/blob/20250822.1/etl/ccdi/transformations/phs003519.json"	"cd70aa16-7cf2-49c6-a6e8-53fc2cc5144e"	"a9970b40-2046-504a-86c6-682e6c73f434"
"reference_file"	"0eb4dd02-1b60-5905-ab49-c8bdbd4813dd"	"0a994bcb-3af7-405f-a41d-1d547c4d77dd"	"CCDI_Submission_Template_v3.1.0_phs003519_JoinRy_2025-08-04.xlsx"	"xlsx"	"Excel spreadsheet (XLSX) file containing input source data"	"input source data"	"1118487"	"da4575ba4ed01fc5cdeb7de1ca0eb961"	"See CCDI Hub at https://ccdi.cancer.gov/explore"	"39c6f84d-20aa-4002-8971-71fdf73550e0"	"a9970b40-2046-504a-86c6-682e6c73f434"
